{
  "$schema": "https://json-schema.org/draft/2020-12/schema",
  "$id": "https://perfeng.dev/schemas/workload/v1/workload.schema.json",
  "$defs": {
    "id": {
      "type": "string",
      "description": "a string matching the pattern ^[a-z][a-z0-9]*(?:-[a-z0-9]+)*$",
      "pattern": "^[a-z][a-z0-9]*(?:-[a-z0-9]+)*$"
    },
    "version": {
      "type": "string",
      "description": "a string matching the pattern ^(0|[1-9][0-9]*)\\.(0|[1-9][0-9]*)\\.(0|[1-9][0-9]*)$",
      "pattern": "^(0|[1-9][0-9]*)\\.(0|[1-9][0-9]*)\\.(0|[1-9][0-9]*)$"
    },
    "relativePath": {
      "type": "string",
      "description": "a string matching the pattern ^(?!\\/)(?!.*(?:^|\\/)\\.{1,2}(?:\\/|$))[A-Za-z0-9_./-]+$",
      "pattern": "^(?!\\/)(?!.*(?:^|\\/)\\.{1,2}(?:\\/|$))[A-Za-z0-9_./-]+$"
    },
    "sha256": {
      "type": "string",
      "description": "a string matching the pattern ^[a-f0-9]{64}$",
      "pattern": "^[a-f0-9]{64}$"
    }
  },
  "type": "object",
  "required": [
    "schemaVersion",
    "id",
    "version",
    "tool",
    "profile",
    "model",
    "configuration",
    "phases",
    "dataset"
  ],
  "properties": {
    "schemaVersion": {
      "type": "number",
      "enum": [
        1
      ]
    },
    "id": {
      "$ref": "#/$defs/id"
    },
    "version": {
      "$ref": "#/$defs/version"
    },
    "tool": {
      "type": "string",
      "enum": [
        "k6",
        "playwright",
        "kube-burner"
      ]
    },
    "profile": {
      "type": "string",
      "enum": [
        "smoke",
        "average",
        "regression",
        "stress",
        "capacity",
        "soak"
      ]
    },
    "model": {
      "type": "string",
      "enum": [
        "open",
        "closed"
      ]
    },
    "configuration": {
      "type": "object",
      "required": [
        "path",
        "sha256"
      ],
      "properties": {
        "path": {
          "$ref": "#/$defs/relativePath"
        },
        "sha256": {
          "$ref": "#/$defs/sha256"
        }
      },
      "additionalProperties": false
    },
    "phases": {
      "type": "object",
      "required": [
        "unit",
        "warmup",
        "measurement",
        "cooldown"
      ],
      "properties": {
        "unit": {
          "type": "string",
          "enum": [
            "seconds",
            "iterations"
          ]
        },
        "warmup": {
          "type": "integer",
          "description": "a non-negative number",
          "title": "greaterThanOrEqualTo(0)",
          "minimum": 0
        },
        "measurement": {
          "type": "integer",
          "description": "a number greater than or equal to 1",
          "title": "greaterThanOrEqualTo(1)",
          "minimum": 1
        },
        "cooldown": {
          "type": "integer",
          "description": "a non-negative number",
          "title": "greaterThanOrEqualTo(0)",
          "minimum": 0
        }
      },
      "additionalProperties": false
    },
    "dataset": {
      "anyOf": [
        {
          "type": "object",
          "required": [
            "kind"
          ],
          "properties": {
            "kind": {
              "type": "string",
              "enum": [
                "none"
              ]
            }
          },
          "additionalProperties": false
        },
        {
          "type": "object",
          "required": [
            "kind",
            "id",
            "version",
            "sha256",
            "seed"
          ],
          "properties": {
            "kind": {
              "type": "string",
              "enum": [
                "versioned"
              ]
            },
            "id": {
              "$ref": "#/$defs/id"
            },
            "version": {
              "$ref": "#/$defs/version"
            },
            "sha256": {
              "$ref": "#/$defs/sha256"
            },
            "seed": {
              "type": "integer",
              "description": "a non-negative number",
              "title": "greaterThanOrEqualTo(0)",
              "minimum": 0
            }
          },
          "additionalProperties": false
        }
      ]
    }
  },
  "additionalProperties": false,
  "title": "Versioned workload definition",
  "allOf": [
    {
      "if": {
        "properties": {
          "tool": {
            "const": "k6"
          }
        }
      },
      "then": {
        "properties": {
          "phases": {
            "properties": {
              "unit": {
                "const": "seconds"
              }
            }
          }
        }
      }
    },
    {
      "if": {
        "properties": {
          "tool": {
            "const": "playwright"
          }
        }
      },
      "then": {
        "properties": {
          "model": {
            "const": "closed"
          },
          "phases": {
            "properties": {
              "unit": {
                "const": "iterations"
              }
            }
          }
        }
      }
    },
    {
      "if": {
        "properties": {
          "tool": {
            "const": "kube-burner"
          }
        }
      },
      "then": {
        "properties": {
          "model": {
            "const": "open"
          },
          "phases": {
            "properties": {
              "unit": {
                "const": "iterations"
              }
            }
          }
        }
      }
    }
  ]
}
